[
  {
    "id": "R1",
    "ru": "Ударение и «честные» гласные: ударение на предпоследнем слоге, o = [о], e = [э]", "hint": "Ударение на предпоследний слог: WO-da, KA-wa.",
    "remedy": "ch01.s01",
    "cluster": "R1"
  },
  { "id": "R2", "ru": "c = [ц], ch = h = [х], w = [в], j = [й], y = [ы], ó = [у]", "hint": "y = [ы], i = [и]. c = [ц]: cena [цэ́на].", "remedy": "ch01.s02", "cluster": "R2" },
  { "id": "R3", "ru": "ł = [ў], l — среднее л", "hint": "ł звучит как английское w, l — как среднее л.", "remedy": "ch01.s03", "cluster": "R3" },
  { "id": "R4", "ru": "sz, cz, rz/ż твёрдые; после p/t/k rz = [ш]", "hint": "rz звучит как ж; cz и sz твёрдые: czy [чы].", "remedy": "ch01.s04", "cluster": "R4" },
  { "id": "R5", "ru": "Мягкий ряд: ś = si, ć = ci, ź = zi, ń = ni, dź = dzi", "remedy": "ch01.s05", "cluster": "R5" },
  { "id": "R6", "ru": "Три ряда рядом: s/sz/ś, c/cz/ć, z/ż/ź", "hint": "sz, cz, ż — твёрдые [ш], [ч], [ж]; ś, ć, ź — мягкие [щ], [чь], [жь]; s, c, z — [с], [ц], [з].", "cluster": "R6", "remedy": "ch01.s06" },
  { "id": "R7", "ru": "Носовые ą, ę", "hint": "ą, ę перед согласной звучат как [ом]/[эн]: ręka = [рэ́нка]; ę на конце почти [э].", "cluster": "R7", "remedy": "ch01.s07" },
  { "id": "R8", "ru": "i как знак мягкости: nie — один слог", "hint": "i перед гласной не отдельный слог, а мягкость: mia·sto — два слога, nie — один.", "cluster": "R8", "remedy": "ch01.s08" },
  { "id": "R9", "ru": "Кластеры и оглушение: chleb = [хлеп], w после глухой = [ф]", "hint": "Длинное читай по слогам. w перед глухим = [ф].", "cluster": "R9", "remedy": "ch01.s09" },
  { "id": "R10", "ru": "Один звук — две буквы: rz/ż, ó/u, ch/h", "hint": "rz и ż, ó и u, ch и h звучат одинаково: какую букву писать, надо запомнить вместе со словом.", "cluster": "R10", "remedy": "ch01.s10" },
  { "id": "orth.rz_z", "ru": "rz или ż: звучат одинаково, пишутся по-разному", "hint": "Звучат одинаково. morze: море (morski), może: может.", "cluster": "R10", "remedy": "ch01.s10" },
  { "id": "orth.o_u", "ru": "ó или u: звучат одинаково, пишутся по-разному", "hint": "ó читается [у], по буквам «o z kreską».", "cluster": "R10", "remedy": "ch01.s10" },
  { "id": "orth.ch_h", "ru": "ch или h: звучат одинаково, пишутся по-разному", "hint": "ch и h звучат одинаково [х]: написание запоминается вместе со словом.", "cluster": "R10", "remedy": "ch01.s10" },
  { "id": "orth.diacritics", "ru": "Пропущены хвостики и чёрточки: ą ę ś ć ź ż ń ł ó", "remedy": "ch01.s07" },
  { "id": "orth.typo", "ru": "Опечатка в длинном слове" },
  { "id": "ph.stress", "ru": "Ударение не на предпоследнем слоге", "hint": "Ударение на предпоследний слог: WO-da, KA-wa.", "remedy": "ch01.s01", "cluster": "R1" },
  { "id": "ph.vowel_o", "ru": "Аканье: o читается как [а]", "hint": "o всегда [о], без аканья: [во́да].", "remedy": "ch01.s01", "cluster": "R1" },
  { "id": "ph.c_ts", "ru": "c читается как [к] или [с], а надо [ц]", "hint": "c = [ц]: cena [цэ́на]. Цена, а не сено.", "remedy": "ch01.s02", "cluster": "R2" },
  { "id": "ph.l_w", "ru": "ł и l перепутаны: ł = [ў], l — среднее л", "hint": "ł звучит как английское w: łata [ўа́та].", "remedy": "ch01.s03", "cluster": "R3" },
  { "id": "ph.cz_soft", "ru": "cz/sz смягчены: czy = [чы], не [чи]", "hint": "cz и sz твёрдые: czy = [чы], szyba = [шы́ба].", "remedy": "ch01.s04", "cluster": "R4" },
  { "id": "ph.rz_sz", "ru": "После p, t, k, ch буквы rz читаются [ш]", "hint": "Przepraszam [пшэпра́шам]: извините. rz после p = [ш].", "remedy": "ch01.s04", "cluster": "R4" },
  { "id": "ph.soft_spelling", "ru": "ś/si, ć/ci, ń/ni: чёрточка или i перед гласной", "hint": "ci = мягкое [чь]: ciasto [чя́сто], пирог. sz = [ш]: kasza, каша.", "remedy": "ch01.s05", "cluster": "R5" },
  { "id": "ff.stol", "ru": "stół = стол, а не стул (стул — krzesło)", "remedy": "ch01.s03" },
  { "id": "ff.krzeslo", "ru": "krzesło = стул, а не кресло (кресло — fotel)", "remedy": "ch01.s04" },
  { "id": "ff.czas", "ru": "czas = время, а не час (час — godzina)", "remedy": "ch01.s04" },
  { "id": "ff.dworzec", "ru": "dworzec = вокзал, а не дворец (дворец — pałac)", "hint": "dworzec: вокзал, не дворец.", "remedy": "ch01.s10" },
  { "id": "ff.sklep", "ru": "sklep = магазин, а не склеп", "remedy": "ch01.s11" },
  { "id": "gr.gender_adj", "ru": "Род прилагательного: mała kawa, mały stół", "remedy": "ch01.s03" },
  { "id": "gr.register", "ru": "Регистр: cześć — на «ты», dzień dobry — вежливо; не вместе", "remedy": "ch01.s05" },
  { "id": "ph.nasal", "ru": "ą/ę читаются по соседу: ręka = [рэ́нка], ząb = [зомп]", "hint": "ę перед k звучит [эн]: ręka [рэ́нка], рука.", "remedy": "ch01.s07", "cluster": "R7" },
  { "id": "ph.nasal_end", "ru": "Конечное ę = [э]: proszę = [про́шэ]", "remedy": "ch01.s07", "cluster": "R7" },
  { "id": "ph.i_soft", "ru": "i перед гласной — мягкость, не слог: nie, mia·sto", "hint": "i перед гласной только смягчает: Ka-sia, mia-sto.", "remedy": "ch01.s08", "cluster": "R8" },
  { "id": "ph.devoice", "ru": "Оглушение: chleb = [хлеп], w после глухой = [ф]", "hint": "Длинное читай по слогам. w перед глухим = [ф].", "remedy": "ch01.s09", "cluster": "R9" }
]
